{
  "$schema": "https://json-schema.org/draft/2020-12/schema",
  "$id": "https://github.com/Litenova-Solutions/Engineering-Standards/schemas/standards-project.schema.json",
  "title": "Litenova Standards Consumer Project",
  "type": "object",
  "additionalProperties": false,
  "required": ["project", "profile", "reviewedStandardsVersion", "paths", "selectedExtensions", "overrides"],
  "properties": {
    "$schema": { "type": "string" },
    "project": {
      "type": "object",
      "additionalProperties": false,
      "required": ["name"],
      "properties": {
        "name": { "type": "string", "minLength": 1 },
        "identifierSource": {
          "description": "The source segment this project's own identifiers carry in a cross-source citation. Defaults to the project name in lower kebab case.",
          "type": "string",
          "pattern": "^[a-z][a-z0-9-]*$"
        },
        "citedSources": {
          "description": "Other sources a citation in this project may name, beyond owasp, rfc, and standards.",
          "type": "array",
          "uniqueItems": true,
          "items": { "type": "string", "pattern": "^[a-z][a-z0-9-]*$" }
        }
      }
    },
    "profile": {
      "type": "string",
      "pattern": "^[a-z][a-z0-9-]*$"
    },
    "releaseStage": {
      "description": "The release stage of this consumer: pre-production before the first deployment holds customer data, production after. See the stage extension.",
      "type": "string",
      "enum": ["pre-production", "production"]
    },
    "reviewedStandardsVersion": {
      "description": "The standards release whose complete contract this project last reviewed.",
      "type": "string",
      "pattern": "^\\d+\\.\\d+\\.\\d+$"
    },
    "paths": {
      "type": "object",
      "additionalProperties": false,
      "required": ["domainDocs", "uiDocs", "frontends"],
      "properties": {
        "apiSolution": {
          "description": "Path to the API solution. A consumer with no backend omits it and records a SCOPE.BACKEND.001 decision.",
          "$ref": "#/$defs/projectPath"
        },
        "docs": {
          "description": "Root of the specification tree. Every Markdown file under it carries a metadata block unless the path is listed in unstructuredDocs.",
          "$ref": "#/$defs/projectPath"
        },
        "language": {
          "description": "The project language record, validated against schemas/language.schema.json. Defaults to language.json under the documentation root.",
          "$ref": "#/$defs/projectPath"
        },
        "languageScan": {
          "description": "Glob patterns naming the non-Markdown surfaces the vocabulary is checked over: source, interface copy, the API contract, acceptance tests. Repository-relative. A scope in the language record is matched against the repository-relative path for these files. Each pattern must match at least one file.",
          "type": "array",
          "items": {
            "type": "string",
            "minLength": 1
          },
          "uniqueItems": true
        },
        "unstructuredDocs": {
          "description": "Paths whose Markdown is navigation or prose rather than specification.",
          "type": "array",
          "uniqueItems": true,
          "items": {
            "$ref": "#/$defs/projectPath"
          }
        },
        "domainDocs": { "$ref": "#/$defs/projectPath" },
        "testRoots": {
          "description": "Directories holding automated test source. An acceptance criterion is cited from one of these, as a scenario tag, a C# AcceptanceCriterion trait, or a bracketed browser-test title.",
          "type": "array",
          "uniqueItems": true,
          "items": { "$ref": "#/$defs/projectPath" }
        },
        "surfaces": {
          "description": "The surfaces outside paths.frontends that invoke a use case: a command-line tool, a distributed server, a background host, an event reaction. Each frontend is already a surface under its own name. A Consumers row names one of these.",
          "type": "array",
          "uniqueItems": true,
          "items": {
            "type": "object",
            "additionalProperties": false,
            "required": ["name", "description"],
            "properties": {
              "name": { "type": "string", "pattern": "^[a-z][a-z0-9-]*$" },
              "description": { "type": "string", "minLength": 1 },
              "path": { "$ref": "#/$defs/projectPath" }
            }
          }
        },
        "uiDocs": { "$ref": "#/$defs/projectPath" },
        "uiPackage": {
          "description": "The workspace's one shared UI package: the registry configuration, the copied primitive source, the token stylesheet, the source lock, and the design contract. A workspace with no controlled web frontend omits it.",
          "$ref": "#/$defs/uiPackage"
        },
        "uiPatterns": {
          "description": "The workspace UI pattern catalog, validated against schemas/ui-pattern-catalog.schema.json. A workspace that records no pattern decisions omits it.",
          "$ref": "#/$defs/projectPath"
        },
        "frontends": {
          "type": "array",
          "items": {
            "type": "object",
            "additionalProperties": false,
            "required": ["name", "path", "platform"],
            "properties": {
              "name": { "type": "string", "pattern": "^[a-z][a-z0-9-]*$" },
              "path": { "$ref": "#/$defs/projectPath" },
              "platform": {
                "description": "The frontend platform. Required on every entry, so a frontend outside the controlled UI contract declares that position instead of omitting the field.",
                "type": "string",
                "enum": ["react-web", "react-native", "svelte", "other-web"]
              },
              "ui": { "$ref": "#/$defs/ui" }
            },
            "allOf": [
              {
                "if": { "required": ["ui"] },
                "then": {
                  "required": ["platform"],
                  "properties": { "platform": { "enum": ["react-web", "svelte"] } }
                }
              },
              {
                "if": {
                  "properties": { "platform": { "enum": ["react-web", "svelte"] } },
                  "required": ["platform"]
                },
                "then": { "required": ["ui"] }
              }
            ]
          }
        },
        "sites": {
          "description": "The static public websites this consumer ships beside its application. Each entry names the site, its directory, and the generator that builds it.",
          "type": "array",
          "uniqueItems": true,
          "items": {
            "type": "object",
            "additionalProperties": false,
            "required": ["name", "path", "generator"],
            "properties": {
              "name": { "type": "string", "pattern": "^[a-z][a-z0-9-]*$" },
              "path": { "$ref": "#/$defs/projectPath" },
              "generator": {
                "description": "The static generator that builds the site.",
                "type": "string",
                "enum": ["astro"]
              }
            }
          }
        }
      }
    },
    "allOf": [
      {
        "$comment": "A controlled web frontend composes the shared package, so declaring one makes the package required. A workspace whose frontends are all outside the contract declares no package.",
        "if": {
          "required": ["frontends"],
          "properties": {
            "frontends": {
              "contains": {
                "required": ["platform"],
                "properties": { "platform": { "enum": ["react-web", "svelte"] } }
              }
            }
          }
        },
        "then": { "required": ["uiPackage"] }
      }
    ],
    "scenarioWordLimit": {
      "description": "The word bound a Scenario section stays within. Omitted, the recorded default of 120 applies, and the validator refuses a value below 40.",
      "type": "integer"
    },
    "prose": {
      "description": "Where the controlled-prose baseline lives. The baseline records the debt a page carried when the measures were first applied to it, and a page whose lastReviewed date moves leaves the baseline.",
      "type": "object",
      "additionalProperties": false,
      "properties": {
        "baseline": {
          "description": "Defaults to prose-baseline.json under the documentation root.",
          "$ref": "#/$defs/projectPath"
        },
        "enforcement": {
          "description": "Whether the prose measures, the prose baseline and the mannered terms fail the consumer validator ('refuse', the default) or are reported as advisories ('report'). Rejected synonyms always fail. A consumer that reports names the overridden provisions in 'overrides'.",
          "enum": ["refuse", "report"]
        }
      }
    },
    "prohibitedKinds": {
      "description": "Specification kinds this consumer does not use. A specification declaring one is refused.",
      "type": "array",
      "uniqueItems": true,
      "items": {
        "type": "string",
        "pattern": "^[a-z][a-z0-9-]*$"
      }
    },
    "parity": {
      "description": "Configuration for the specification and use-case parity check. Every field is optional and every default is empty.",
      "type": "object",
      "additionalProperties": false,
      "properties": {
        "applicationProject": {
          "description": "The Application project directory, when discovery by convention cannot resolve exactly one.",
          "$ref": "#/$defs/projectPath"
        },
        "ignoreHandlers": {
          "description": "Glob patterns for handlers that carry no use-case specification.",
          "type": "array",
          "uniqueItems": true,
          "items": {
            "type": "string",
            "minLength": 1
          }
        },
        "ignoreUseCases": {
          "description": "Use-case specification ids that resolve to no handler.",
          "type": "array",
          "uniqueItems": true,
          "items": {
            "type": "string",
            "pattern": "^[a-z][a-z0-9-]*\\.[a-z][a-z0-9-]*$"
          }
        },
        "sourceRoots": {
          "description": "Directories an Implementation mapping name resolves a declaration, project, or path in. Defaults to the directory holding the solution.",
          "type": "array",
          "uniqueItems": true,
          "items": { "$ref": "#/$defs/projectPath" }
        },
        "foreignNames": {
          "description": "Names an Implementation mapping states that a package declares rather than this repository, which no local scan can find.",
          "type": "array",
          "uniqueItems": true,
          "items": { "type": "string", "minLength": 1 }
        }
      }
    },
    "specSync": {
      "description": "Configuration for the specification-sync validator. Every field is optional, and each default is derived from paths.",
      "type": "object",
      "additionalProperties": false,
      "properties": {
        "codeRoots": {
          "description": "Directories whose C# files are read for marking tags. Defaults to apps/api/src and apps/api/tests.",
          "type": "array",
          "uniqueItems": true,
          "items": { "$ref": "#/$defs/projectPath" }
        },
        "markedRoots": {
          "description": "Directories whose type-declaring files must carry a tag. Defaults to the Domain, Application, and WebApi projects plus every test root.",
          "type": "array",
          "uniqueItems": true,
          "items": { "$ref": "#/$defs/projectPath" }
        },
        "featureRoots": {
          "description": "Directories holding Reqnroll feature files, for a consumer whose BDD runner is Reqnroll. Defaults to apps/api/tests/{ProjectName}.Acceptance.Tests/Features, where {ProjectName} is project.name. A LightBDD scenario is C# and is read from codeRoots.",
          "type": "array",
          "uniqueItems": true,
          "items": { "$ref": "#/$defs/projectPath" }
        },
        "evidenceRoots": {
          "description": "Frontend directories whose test files are read for acceptance-criterion citations. Defaults to every path in paths.frontends.",
          "type": "array",
          "uniqueItems": true,
          "items": { "$ref": "#/$defs/projectPath" }
        }
      }
    },
    "selectedExtensions": {
      "description": "Extensions active for this project. A bare string selects the extension. An object also records the criterion that was met and the date the selection is next reviewed, so a selection that costs nothing to keep still expires.",
      "type": "array",
      "uniqueItems": true,
      "items": {
        "oneOf": [
          { "type": "string", "pattern": "^[a-z][a-z0-9-]*$" },
          {
            "type": "object",
            "additionalProperties": false,
            "required": ["id", "criterion", "reviewBy"],
            "properties": {
              "id": { "type": "string", "pattern": "^[a-z][a-z0-9-]*$" },
              "criterion": { "type": "string", "minLength": 1 },
              "reviewBy": { "type": "string", "pattern": "^\\d{4}-\\d{2}-\\d{2}$" }
            }
          }
        ]
      }
    },
    "overrides": {
      "type": "array",
      "items": {
        "type": "object",
        "additionalProperties": false,
        "required": ["provisionId", "decision"],
        "properties": {
          "provisionId": { "type": "string", "pattern": "^standards/rule/[a-z][a-z0-9-]*\\.[a-z0-9][a-z0-9-]*$" },
          "decision": { "$ref": "#/$defs/projectPath" },
          "reviewBy": {
            "type": "string",
            "pattern": "^\\d{4}-\\d{2}-\\d{2}$"
          }
        },
        "allOf": [
          {
            "if": {
              "properties": { "provisionId": { "pattern": "^standards/rule/frontend-ui\\." } },
              "required": ["provisionId"]
            },
            "then": { "required": ["reviewBy"] }
          }
        ]
      }
    }
  },
  "$defs": {
    "projectPath": {
      "type": "string",
      "minLength": 1,
      "pattern": "^(?![A-Za-z]:)(?!/)(?!.*\\.\\.)[^\\\\]+$"
    },
    "uiPackage": {
      "type": "object",
      "additionalProperties": false,
      "required": ["name", "path", "componentsJson", "primitives", "tokens", "sourceLock", "designContract", "publicExports"],
      "properties": {
        "name": { "type": "string", "minLength": 1 },
        "path": { "$ref": "#/$defs/projectPath" },
        "componentsJson": { "$ref": "#/$defs/projectPath" },
        "primitives": {
          "description": "The directory holding the registry source the pinned CLI copied in.",
          "$ref": "#/$defs/projectPath"
        },
        "tokens": { "$ref": "#/$defs/projectPath" },
        "sourceLock": { "$ref": "#/$defs/projectPath" },
        "designContract": { "$ref": "#/$defs/projectPath" },
        "publicExports": {
          "description": "The entry points applications may import. A primitive the composites are built from is not one of them.",
          "type": "array",
          "minItems": 1,
          "uniqueItems": true,
          "items": { "type": "string", "minLength": 1 }
        }
      }
    },
    "ui": {
      "type": "object",
      "additionalProperties": false,
      "required": ["profile"],
      "properties": {
        "profile": {
          "description": "The density profile this frontend composes the shared package at.",
          "type": "string",
          "enum": ["public-light", "application-balanced", "admin-dense"]
        },
        "globalCss": {
          "description": "The one stylesheet this frontend declares, which imports the shared package's tokens.",
          "$ref": "#/$defs/projectPath"
        }
      }
    }
  }
}
