{
  "$schema": "./standards/schemas/standards-project.schema.json",
  "project": {
    "name": "__PROJECT__"
  },
  "profile": "dotnet-react",
  "reviewedStandardsVersion": "1.18.0",
  "paths": {
    "apiSolution": "__API_SOLUTION__",
    "docs": "docs",
    "domainDocs": "docs/domain",
    "uiDocs": "docs/ui",
    "unstructuredDocs": [],
    "surfaces": [],
    "testRoots": [],
    "languageScan": [],
    "uiPackage": {
      "name": "@__PROJECT__/ui",
      "path": "packages/ui",
      "componentsJson": "packages/ui/components.json",
      "primitives": "packages/ui/src/components",
      "tokens": "packages/ui/src/styles/tokens.css",
      "sourceLock": "packages/ui/ui-source-lock.json",
      "designContract": "packages/ui/DESIGN.md",
      "publicExports": ["@__PROJECT__/ui/floorplans", "@__PROJECT__/ui/display", "@__PROJECT__/ui/forms"]
    },
    "uiPatterns": "docs/ui/pattern-catalog.json",
    "frontends": [
      {
        "name": "web",
        "path": "apps/web",
        "platform": "react-web",
        "ui": {
          "profile": "application-balanced",
          "globalCss": "apps/web/src/styles.css"
        }
      }
    ],
    "sites": []
  },
  "selectedExtensions": [],
  "prohibitedKinds": [],
  "overrides": [],
  "parity": {
    "ignoreHandlers": [],
    "ignoreUseCases": [],
    "sourceRoots": [],
    "foreignNames": []
  }
}
